<?xml version="1.0" encoding="UTF-8" standalone="no"?><rulepayload xmlns:xsi="http://www.w3.org/2001/XMLSchema-instance" xsi:noNamespaceSchemaLocation="rulepayload.xsd">
	<header>
		<timestamp>2012-01-02T20:05:05.491+10:30</timestamp>
		<ruleFileName>ThisServiceControlNode</ruleFileName>
		<ruleBaseVersion>v001</ruleBaseVersion>
		<ruleBaseCommitment>1</ruleBaseCommitment>
	</header>
	<targetservice>
		<serviceName>P1</serviceName>
		<operationName>processToken</operationName>
		<businessService>P1</businessService>
	</targetservice>
	<rulefiledata><data><![CDATA[<Atom><Rel>NodeType</Rel><Ind>EdgeNode</Ind></Atom>]]></data>
	</rulefiledata>
</rulepayload>